{
  "$schema": "urn:kingdom:schema:karma-receipt:0.1",
  "protocol": "kingdom.karma/0.1",
  "accounting": "receipts_not_scores",
  "state": "final",
  "receipt_id": "karma-2026-10-27-navigate-dark-continent-hf-pin-drift",
  "ability_id": "navigate-dark-continent",
  "ability_revision": "b719f2546c8765238a8f0ca0cfee9884669864c0",
  "ability_manifest_sha256": "sha256:15368a500b39b5abe0ba3efd2de2e6d104ae67cea532fa6392a3838d98f63fb1",
  "ability_bundle_sha256": "sha256:ba7c8a4c38aee14475112c2a1c712df1b8e5569247077d3e5c81f459795e228f",
  "invocation_id": "navigate-dark-continent.2026-10-27.hf-pin-drift",
  "started_at": "2026-10-27T18:11:29.723Z",
  "finished_at": "2026-10-27T18:17:51.557Z",
  "authority": {
    "authority_reference": "The owner's explicit decision in a Claude Code session on 2026-10-27 ('3. yes!' to: register the Nen MCP, clone hf-kingdom-lab, run one bounded expedition and bring back the first real KARMA receipt). Operational authority for this one expedition, bounded by charter.yaml in this record. The participant, consent and representative-authority lists are empty because only public repository metadata was read and no participant-specific basis was relied on.",
    "affected_participants": [],
    "consent_references": [],
    "representative_authority_references": [],
    "permissions_used": [
      "local_read",
      "remote_public_metadata_read: 35 anonymous GETs of a 70-request budget",
      "local_evidence_write: this record directory and session scratch"
    ]
  },
  "inputs": [
    {
      "source": "cambridgetcg/KINGDOM-OS (local Git objects or read-only extract; device path not recorded)",
      "revision": "b719f2546c8765238a8f0ca0cfee9884669864c0",
      "path": "skills/navigate-dark-continent/references/hf-boundaries.md",
      "license_assertion": "none declared (no repository license file at this revision)",
      "bytes": {
        "value": "11260",
        "basis": "observed"
      },
      "digest": "sha256:9af2593e8f06d6075d352736b1b240a1fee3856622bdf0bdb04728a1ad9bc757",
      "boundary": "local",
      "assurance": "untrusted_evidence"
    },
    {
      "source": "cambridgetcg/agenttool (local Git objects or read-only extract; device path not recorded)",
      "revision": "8947c8fdf17c60590ad4d983f6a464cd0de28983",
      "path": "packages/dark-continent-karma/hf/dataset/data/treasure-index.jsonl",
      "license_assertion": "Apache-2.0 (package license; dataset card license: apache-2.0)",
      "bytes": {
        "value": "48811",
        "basis": "observed"
      },
      "digest": "sha256:49d29d78d5d7a31686e373d06487cdfb7eed6727289581e45c1cb4b0e2d2252f",
      "boundary": "local",
      "assurance": "untrusted_evidence"
    },
    {
      "source": "cambridgetcg/agenttool (local Git objects or read-only extract; device path not recorded)",
      "revision": "8947c8fdf17c60590ad4d983f6a464cd0de28983",
      "path": "packages/dark-continent-karma/hf/space/source-manifest.json",
      "license_assertion": "Apache-2.0 (package license)",
      "bytes": {
        "value": "1138",
        "basis": "observed"
      },
      "digest": "sha256:cdd879791468c819a900198d9f13c56b69cafbf5a09c4326af21810b08d231f2",
      "boundary": "local",
      "assurance": "untrusted_evidence"
    },
    {
      "source": "cambridgetcg/agenttool (local Git objects or read-only extract; device path not recorded)",
      "revision": "8947c8fdf17c60590ad4d983f6a464cd0de28983",
      "path": "packages/dark-continent-karma/hf/dataset/README.md",
      "license_assertion": "Apache-2.0 (package license; card front matter license: apache-2.0)",
      "bytes": {
        "value": "5856",
        "basis": "observed"
      },
      "digest": "sha256:1751beef0e10cdede196bc8d6f76a8086aa357be236a5fa4d90b8390db6fa6e1",
      "boundary": "local",
      "assurance": "untrusted_evidence"
    },
    {
      "source": "cambridgetcg/hf-kingdom-lab (local Git objects or read-only extract; device path not recorded)",
      "revision": "d8e48068bd9af7689f3fea6cbb8d05d4e10e312a",
      "path": "committed tree (git ls-tree -r listing digested; git grep over every path)",
      "license_assertion": "Apache-2.0 (repository LICENSE); only searched, nothing reused",
      "bytes": {
        "value": "5956",
        "basis": "observed"
      },
      "digest": "sha256:ed78616fcfa3ed3a3e3ff39083b1a20245e250b2e1f82bbf1740a7a6bd5f1456",
      "boundary": "local",
      "assurance": "untrusted_evidence"
    },
    {
      "source": "huggingface.co Hub API, model mlx-community/gpt-oss-20b-MXFP4-Q8 (request 1, 2026-10-27T18:13:19.939Z)",
      "revision": "mutable head requested; response reported 773a7da77e569019bb0fd17a554b263738d669a3",
      "path": "/api/models/mlx-community/gpt-oss-20b-MXFP4-Q8?expand=sha&expand=lastModified&expand=private&expand=gated&expand=disabled&expand=cardData&expand=tags",
      "license_assertion": "Hub metadata under the Hub's terms; the subject repository's card asserts apache-2.0",
      "bytes": {
        "value": "556",
        "basis": "observed"
      },
      "digest": "sha256:ebe434cd700c4745cc4d751b4c2d986c86031f9b93cfb4b0c5401beff3ca9f0b",
      "boundary": "remote_public",
      "assurance": "untrusted_evidence"
    },
    {
      "source": "huggingface.co Hub API, model mlx-community/Qwen3-30B-A3B-Instruct-2507-4bit (request 2, 2026-10-27T18:13:20.251Z)",
      "revision": "mutable head requested; response reported e9675aa3ca5f900ccef55267914466d55ab325fa",
      "path": "/api/models/mlx-community/Qwen3-30B-A3B-Instruct-2507-4bit?expand=sha&expand=lastModified&expand=private&expand=gated&expand=disabled&expand=cardData&expand=tags",
      "license_assertion": "Hub metadata under the Hub's terms; the subject repository's card asserts apache-2.0",
      "bytes": {
        "value": "689",
        "basis": "observed"
      },
      "digest": "sha256:3bb0d18f48af0e3b90a8b408a7db2ef66b92a8398f129b59b869de0dff4ab9ba",
      "boundary": "remote_public",
      "assurance": "untrusted_evidence"
    },
    {
      "source": "huggingface.co Hub API, model Xenova/all-MiniLM-L6-v2 (request 3, 2026-10-27T18:13:20.653Z)",
      "revision": "mutable head requested; response reported 751bff37182d3f1213fa05d7196b954e230abad9",
      "path": "/api/models/Xenova/all-MiniLM-L6-v2?expand=sha&expand=lastModified&expand=private&expand=gated&expand=disabled&expand=cardData&expand=tags",
      "license_assertion": "Hub metadata under the Hub's terms; the subject repository's card asserts apache-2.0",
      "bytes": {
        "value": "535",
        "basis": "observed"
      },
      "digest": "sha256:9e2c30e0b53716761c568e9bb1d6bac2647f18cda5adcb22e3401489d88c6d69",
      "boundary": "remote_public",
      "assurance": "untrusted_evidence"
    },
    {
      "source": "huggingface.co Hub API, model sentence-transformers/paraphrase-multilingual-MiniLM-L12-v2 (request 4, 2026-10-27T18:13:21.195Z)",
      "revision": "mutable head requested; response reported e8f8c211226b894fcb81acc59f3b34ba3efd5f42",
      "path": "/api/models/sentence-transformers/paraphrase-multilingual-MiniLM-L12-v2?expand=sha&expand=lastModified&expand=private&expand=gated&expand=disabled&expand=cardData&expand=tags",
      "license_assertion": "Hub metadata under the Hub's terms; the subject repository's card asserts apache-2.0",
      "bytes": {
        "value": "1308",
        "basis": "observed"
      },
      "digest": "sha256:4ccc5ff9505c212ff726490b4540b76fe3b5c35a149b94978f1fb424a29a2ec9",
      "boundary": "remote_public",
      "assurance": "untrusted_evidence"
    },
    {
      "source": "huggingface.co Hub API, model alvanlii/whisper-small-cantonese (request 5, 2026-10-27T18:13:21.702Z)",
      "revision": "mutable head requested; response reported b03a4e5d482f06858ce10ebbabebabec9f447a0d",
      "path": "/api/models/alvanlii/whisper-small-cantonese?expand=sha&expand=lastModified&expand=private&expand=gated&expand=disabled&expand=cardData&expand=tags",
      "license_assertion": "Hub metadata under the Hub's terms; the subject repository's card asserts apache-2.0",
      "bytes": {
        "value": "1236",
        "basis": "observed"
      },
      "digest": "sha256:fa0f0086646a8f2fb7685a3da6108722026f88e25694da863b860dac94b02920",
      "boundary": "remote_public",
      "assurance": "untrusted_evidence"
    },
    {
      "source": "huggingface.co Hub API, dataset leeduckgo/cantonese-life-scenarios-corpus (request 6, 2026-10-27T18:13:22.226Z)",
      "revision": "mutable head requested; response reported e9bfb8f07250faab06a6ad8ed46f9b02567f886c",
      "path": "/api/datasets/leeduckgo/cantonese-life-scenarios-corpus?expand=sha&expand=lastModified&expand=private&expand=gated&expand=disabled&expand=cardData&expand=tags",
      "license_assertion": "Hub metadata under the Hub's terms; the subject repository's card asserts cc-by-4.0",
      "bytes": {
        "value": "403",
        "basis": "observed"
      },
      "digest": "sha256:d4a4e5e165a367e89353fb42bbe61ab0f3f1f26afdda3dc582cf3360759dce90",
      "boundary": "remote_public",
      "assurance": "untrusted_evidence"
    },
    {
      "source": "huggingface.co Hub API, dataset gorilla-llm/Berkeley-Function-Calling-Leaderboard (request 7, 2026-10-27T18:13:22.751Z)",
      "revision": "mutable head requested; response reported 61fc0608cfd831fcfbbaa676ebdfef0ed963eeda",
      "path": "/api/datasets/gorilla-llm/Berkeley-Function-Calling-Leaderboard?expand=sha&expand=lastModified&expand=private&expand=gated&expand=disabled&expand=cardData&expand=tags",
      "license_assertion": "Hub metadata under the Hub's terms; the subject repository's card asserts apache-2.0",
      "bytes": {
        "value": "339",
        "basis": "observed"
      },
      "digest": "sha256:e223611c5f9369a2a397da2741f1202e31767d94a631629d85cb4f99b97d7d41",
      "boundary": "remote_public",
      "assurance": "untrusted_evidence"
    },
    {